{
    "kind": "interface",
    "title": "ShowAtOption Interface",
    "description": "The ShowAt option; this is used to calculate the placement position.",

    "fields": [
        { 
            "name": "container?: DOMRect",
            "type": "DOMRect" ,
            "description": "The rectangle within which the popup must be placed."
        },
        { 
            "name": "distance?: number",
            "type": "number" ,
            "description": "The minimum distance between the popup and the target."
        },
        { 
            "name": "distanceToContainer?: number",
            "type": "number" ,
            "description": "The minimum distance between the popup and the container."
        }
    ]
}
